filename,name,rarity,tags,description,image_url
woodland_felt_sunset_chipmunk_glowing_satchel.png,Sunset Chipmunk,rare,chipmunk|woodland|sunset|satchel|rare|magical,A chipmunk with sunset-gradient fur carrying a tiny satchel filled with glowing seeds.,https://vjfbzpliqialqmabfnxs.supabase.co/storage/v1/object/public/gamification-assets/woodland-felt/rare/woodland_felt_sunset_chipmunk_glowing_satchel.png
woodland_felt_tanuki_leaf_hat.png,Tanuki,rare,tanuki|raccoon dog|woodland|leaf|hat|rare|mythical,"A round cheerful tanuki with a leaf balanced on its head, full of forest magic.",https://vjfbzpliqialqmabfnxs.supabase.co/storage/v1/object/public/gamification-assets/woodland-felt/rare/woodland_felt_tanuki_leaf_hat.png
woodland_felt_tide_otter_glowing_pearl.png,Tide Otter,legendary,otter|woodland|tide|pearl|glow|legendary|magical,"An otter with iridescent blue-green fur, holding a pearl that glows with the tides.",https://vjfbzpliqialqmabfnxs.supabase.co/storage/v1/object/public/gamification-assets/woodland-felt/rare/woodland_felt_tide_otter_glowing_pearl.png
woodland_felt_verdant_bear_moss_flowers.png,Verdant Bear,legendary,bear|woodland|verdant|moss|flowers|legendary|magical,"A bear cub covered in soft living moss and sprouting flowers, a piece of the forest itself.",https://vjfbzpliqialqmabfnxs.supabase.co/storage/v1/object/public/gamification-assets/woodland-felt/rare/woodland_felt_verdant_bear_moss_flowers.png
woodland_felt_wisp_mouse_glowing_orb.png,Will-o-Wisp Mouse,rare,mouse|woodland|wisp|orb|glow|rare|mythical,"A mouse holding a pale glowing orb, leading wanderers safely through the dark forest.",https://vjfbzpliqialqmabfnxs.supabase.co/storage/v1/object/public/gamification-assets/woodland-felt/rare/woodland_felt_wisp_mouse_glowing_orb.png
woodland_felt_wolpertinger_wings_antlers.png,Wolpertinger,rare,wolpertinger|rabbit|woodland|wings|antlers|rare|mythical,"A mischievous wolpertinger with tiny wings and antler nubs, impossible and irresistible.",https://vjfbzpliqialqmabfnxs.supabase.co/storage/v1/object/public/gamification-assets/woodland-felt/rare/woodland_felt_wolpertinger_wings_antlers.png
